<?xml version="1.0"?>
<xs:schema attributeFormDefault="unqualified" elementFormDefault="qualified" xmlns:xs="http://www.w3.org/2001/XMLSchema"
targetNamespace="https://github.com/TestingTechnologies/PlayCustomParameters" xmlns:tns="https://github.com/TestingTechnologies/PlayCustomParameters">

  <xs:complexType name="Attribute">
	<xs:simpleContent>
		<xs:extension base="xs:string">
		  <xs:attribute type="xs:string" name="name"/>
		</xs:extension>
	</xs:simpleContent>
  </xs:complexType>

  <xs:element name="settings">
    <xs:complexType>
      <xs:sequence>
        <xs:element name="widgets">
          <xs:complexType>
            <xs:sequence>
              <xs:element name="widget" maxOccurs="unbounded" minOccurs="0">
                <xs:complexType>
                  <xs:sequence>
                    <xs:element type="xs:string" name="description" minOccurs="0"/>
                    <xs:element name="image" minOccurs="0">
                      <xs:complexType>
                        <xs:simpleContent>
                          <xs:extension base="xs:string">
                            <xs:attribute type="xs:string" name="path"/>
                          </xs:extension>
                        </xs:simpleContent>
                      </xs:complexType>
                    </xs:element>
                    <xs:element name="editor" maxOccurs="unbounded" minOccurs="0">
                      <xs:complexType>
                        <xs:simpleContent>
                          <xs:extension base="xs:string">
                            <xs:attribute type="xs:string" name="parameterId" use="optional"/>
                          </xs:extension>
                        </xs:simpleContent>
                      </xs:complexType>
                    </xs:element>
                  </xs:sequence>
                  <xs:attribute type="xs:string" name="name" use="optional"/>
                </xs:complexType>
              </xs:element>
            </xs:sequence>
          </xs:complexType>
        </xs:element>
        <xs:element name="parameters">
          <xs:complexType>
            <xs:sequence>
              <xs:element name="parameter" maxOccurs="unbounded" minOccurs="0">
                <xs:complexType>
                  <xs:sequence>
                    <xs:element type="xs:string" name="defaultValue" minOccurs="0"/>
                    <xs:element name="description" minOccurs="0">
                      <xs:complexType>
                        <xs:simpleContent>
                          <xs:extension base="xs:string">
                            <xs:attribute type="xs:string" name="visible"/>
                          </xs:extension>
                        </xs:simpleContent>
                      </xs:complexType>
                    </xs:element>
                    <xs:element name="validator" maxOccurs="unbounded" minOccurs="0">
                      <xs:complexType mixed="true">
                        <xs:sequence>
                          <xs:element name="relation" maxOccurs="unbounded" minOccurs="0">
                            <xs:complexType>
                              <xs:simpleContent>
                                <xs:extension base="xs:string">
                                  <xs:attribute type="xs:short" name="parameterId" use="optional"/>
                                </xs:extension>
                              </xs:simpleContent>
                            </xs:complexType>
                          </xs:element>
                          <xs:element name="attribute" type="tns:Attribute" minOccurs="0" maxOccurs="unbounded" />
                        </xs:sequence>
                        <xs:attribute type="xs:string" name="id" use="optional"/>
                      </xs:complexType>
                    </xs:element>
                  </xs:sequence>
                  <xs:attribute type="xs:string" name="id" use="optional"/>
                </xs:complexType>
              </xs:element>
            </xs:sequence>
          </xs:complexType>
        </xs:element>
        <xs:element name="validators">
          <xs:complexType>
            <xs:sequence>
              <xs:element name="validator" maxOccurs="unbounded" minOccurs="0">
                <xs:complexType>
                  <xs:sequence>
                    <xs:element type="xs:string" name="classpath"/>
                    <xs:element name="attribute" type="tns:Attribute" minOccurs="0" maxOccurs="unbounded" />
                  </xs:sequence>
                  <xs:attribute type="xs:string" name="id" use="optional"/>
                </xs:complexType>
              </xs:element>
            </xs:sequence>
          </xs:complexType>
        </xs:element>
      </xs:sequence>
    </xs:complexType>
  </xs:element>

</xs:schema>